[
  {
    "id": "miracles:youtube:d_r9Hje8mj4",
    "provider": "youtube",
    "video_id": "d_r9Hje8mj4",
    "channel_id": "abdulrahman_babgi",
    "category_id": "miracles",
    "title": {
      "ar": "كل معجزات الأنبياء والرسل من آدم إلى محمد ﷺ ، وايش هيا معجزة سيدنا يوسف؟🧐😳"
    },
    "language": "ar",
    "depth": "detailed",
    "duration_seconds": 1008,
    "sort_order": 1
  },
  {
    "id": "miracles:youtube:8DdtAQz6Ht0",
    "provider": "youtube",
    "video_id": "8DdtAQz6Ht0",
    "channel_id": "abdulrahman_babgi",
    "category_id": "miracles",
    "title": {
      "ar": "كل معجزات الأنبياء والرسل من آدم إلى محمد ﷺ (وليش الله امر ابراهيم بذبح ابنه😧😭💔) الجزء 2"
    },
    "language": "ar",
    "depth": "detailed",
    "duration_seconds": 641,
    "sort_order": 2
  },
  {
    "id": "miracles:youtube:2rhnvOpAl94",
    "provider": "youtube",
    "video_id": "2rhnvOpAl94",
    "channel_id": "abdulrahman_babgi",
    "category_id": "miracles",
    "title": {
      "ar": "ايش هيا معجزات يوسف عليه السلام وليش دخل السجن🧐😳💔(معجزات الانبياء 3)"
    },
    "language": "ar",
    "depth": "detailed",
    "duration_seconds": 863,
    "sort_order": 3
  },
  {
    "id": "miracles:youtube:un7XOhwli48",
    "provider": "youtube",
    "video_id": "un7XOhwli48",
    "channel_id": "abdulrahman_babgi",
    "category_id": "miracles",
    "title": {
      "ar": "لماذا كلم الله موسى بنفسه بدون وحي؟ وما الشي الذي رأه وجعله يهرب من الخوف😧😳(معجزات الانبياء 4)"
    },
    "language": "ar",
    "depth": "detailed",
    "duration_seconds": 886,
    "sort_order": 4
  },
  {
    "id": "miracles:youtube:fm56rM18VoE",
    "provider": "youtube",
    "video_id": "fm56rM18VoE",
    "channel_id": "abdulrahman_babgi",
    "category_id": "miracles",
    "title": {
      "ar": "كيف شق موسى البحر وأغرق فرعون بضربة ؟!! ولم تحول نهر النيل الى دم والضفادع😳🌊🩸(معجزات الانبياء 5)"
    },
    "language": "ar",
    "depth": "detailed",
    "duration_seconds": 801,
    "sort_order": 5
  },
  {
    "id": "miracles:youtube:iKcoyKJ32Us",
    "provider": "youtube",
    "video_id": "iKcoyKJ32Us",
    "channel_id": "abdulrahman_babgi",
    "category_id": "miracles",
    "title": {
      "ar": "ماذا فعلو بنو إسرائيل عندما سمعوا صوت الله وعندما احياة موسى ميت بعد ماقتل ظلم😱🤯(معجزات الانبياء 6)"
    },
    "language": "ar",
    "depth": "detailed",
    "duration_seconds": 829,
    "sort_order": 6
  },
  {
    "id": "miracles:youtube:Is_anSQHs80",
    "provider": "youtube",
    "video_id": "Is_anSQHs80",
    "channel_id": "abdulrahman_babgi",
    "category_id": "miracles",
    "title": {
      "ar": "كيف عاش سيدنا يونس في بطن الحوت وايش الصوت الغريب الذي سمعه من الحوت والسمك 😱😧🧐(معجزات الانبياء 7)"
    },
    "language": "ar",
    "depth": "detailed",
    "duration_seconds": 1105,
    "sort_order": 7
  },
  {
    "id": "miracles:youtube:mvoWy72uzA0",
    "provider": "youtube",
    "video_id": "mvoWy72uzA0",
    "channel_id": "abdulrahman_babgi",
    "category_id": "miracles",
    "title": {
      "ar": "ايش الدابة العظيمة التي خرجت لي سليمان وماسر خاتم سليمان السحري😱🤯🧐(معجزات الانبياء 8)"
    },
    "language": "ar",
    "depth": "detailed",
    "duration_seconds": 1075,
    "sort_order": 8
  },
  {
    "id": "miracles:youtube:YB5go1Jsz9M",
    "provider": "youtube",
    "video_id": "YB5go1Jsz9M",
    "channel_id": "abdulrahman_babgi",
    "category_id": "miracles",
    "title": {
      "ar": "قصة الرجل الذي أعاده النبي عيسى للحياة بعد موته!! وقال شيئاً أبكى كل من سمعه😱🤯🧐(معجزات الانبياء 9)"
    },
    "language": "ar",
    "depth": "detailed",
    "duration_seconds": 795,
    "sort_order": 9
  },
  {
    "id": "miracles:youtube:3eluOC6wSEw",
    "provider": "youtube",
    "video_id": "3eluOC6wSEw",
    "channel_id": "abdulrahman_babgi",
    "category_id": "miracles",
    "title": {
      "ar": "لماذا حارب الله وملائكته ابليس يوم مولد الرسول ولماذا فزع ابليس واراد ان ينتقم😧🧐(معجزات الانبياء 10)"
    },
    "language": "ar",
    "depth": "detailed",
    "duration_seconds": 961,
    "sort_order": 10
  }
]
