[
  {
    "id": "youtube:9dSDztvxeZo",
    "provider": "youtube",
    "video_id": "9dSDztvxeZo",
    "channel_id": "yousef_elkott",
    "category_id": "companions",
    "title": {
      "ar": "هل تعرف أبو بكر الصديق حقاً ؟"
    },
    "language": "ar",
    "depth": "detailed",
    "duration_seconds": 2219,
    "sort_order": 1
  },
  {
    "id": "youtube:-rqHQ0_yR6M",
    "provider": "youtube",
    "video_id": "-rqHQ0_yR6M",
    "channel_id": "yousef_elkott",
    "category_id": "companions",
    "title": {
      "ar": "عمر بن الخطاب | الرجل الذي ملأ الأرض عدلًا"
    },
    "language": "ar",
    "depth": "detailed",
    "duration_seconds": 4947,
    "sort_order": 2
  },
  {
    "id": "youtube:NUWoLV6FNf0",
    "provider": "youtube",
    "video_id": "NUWoLV6FNf0",
    "channel_id": "yousef_elkott",
    "category_id": "companions",
    "title": {
      "ar": "عثمان بن عفان | لماذا حاصروه و قتلوه ؟"
    },
    "language": "ar",
    "depth": "detailed",
    "duration_seconds": 6477,
    "sort_order": 3
  },
  {
    "id": "youtube:3FVgXCLPYOo",
    "provider": "youtube",
    "video_id": "3FVgXCLPYOo",
    "channel_id": "yousef_elkott",
    "category_id": "companions",
    "title": {
      "ar": "علي بن أبي طالب | لماذا أحبه النبي ﷺ؟"
    },
    "language": "ar",
    "depth": "detailed",
    "duration_seconds": 3149,
    "sort_order": 4
  },
  {
    "id": "youtube:yB5nxa5X1OM",
    "provider": "youtube",
    "video_id": "yB5nxa5X1OM",
    "channel_id": "yousef_elkott",
    "category_id": "companions",
    "title": {
      "ar": "طلحة بن عبيد الله | رجل أصيب ب 70 طعنة  ولم يمت"
    },
    "language": "ar",
    "depth": "detailed",
    "duration_seconds": 2486,
    "sort_order": 5
  },
  {
    "id": "youtube:XACKEVKVM8k",
    "provider": "youtube",
    "video_id": "XACKEVKVM8k",
    "channel_id": "yousef_elkott",
    "category_id": "companions",
    "title": {
      "ar": "الزبير بن العوام | الصحابي الذي اضطر لقتل عمه في المعركة"
    },
    "language": "ar",
    "depth": "detailed",
    "duration_seconds": 3119,
    "sort_order": 6
  },
  {
    "id": "youtube:LBbrDnS1jN4",
    "provider": "youtube",
    "video_id": "LBbrDnS1jN4",
    "channel_id": "yousef_elkott",
    "category_id": "companions",
    "title": {
      "ar": "عبد الرحمن بن عوف | قصة نجاح من الصفر إلي الغنى الشديد"
    },
    "language": "ar",
    "depth": "detailed",
    "duration_seconds": 2950,
    "sort_order": 7
  },
  {
    "id": "youtube:r9Freb717SU",
    "provider": "youtube",
    "video_id": "r9Freb717SU",
    "channel_id": "yousef_elkott",
    "category_id": "companions",
    "title": {
      "ar": "سعد بن أبي وقاص | الصحابي الذي أسقط إمبراطورية فارس"
    },
    "language": "ar",
    "depth": "detailed",
    "duration_seconds": 3741,
    "sort_order": 8
  },
  {
    "id": "youtube:lD7V_yQoyKQ",
    "provider": "youtube",
    "video_id": "lD7V_yQoyKQ",
    "channel_id": "yousef_elkott",
    "category_id": "companions",
    "title": {
      "ar": "سعيد بن زيد | ماذا فعل حتى يُبشر بالجنة ؟"
    },
    "language": "ar",
    "depth": "detailed",
    "duration_seconds": 2067,
    "sort_order": 9
  },
  {
    "id": "youtube:9dYL7BQo15k",
    "provider": "youtube",
    "video_id": "9dYL7BQo15k",
    "channel_id": "yousef_elkott",
    "category_id": "companions",
    "title": {
      "ar": "أبو عبيدة بن الجراح | الصحابي الذي قتل أباه في سبيل الله"
    },
    "language": "ar",
    "depth": "detailed",
    "duration_seconds": 3496,
    "sort_order": 10
  }
]
