[
  {
    "id": "quran_creatures:youtube:Gaz7uV86yTw",
    "provider": "youtube",
    "video_id": "Gaz7uV86yTw",
    "channel_id": "yousef_elkott",
    "category_id": "quran_creatures",
    "title": {
      "ar": "الذباب | لماذا ضرب الله به مثلًا في القرآن؟"
    },
    "language": "ar",
    "depth": "detailed",
    "duration_seconds": 1735,
    "sort_order": 1
  },
  {
    "id": "quran_creatures:youtube:30m_osNgoUg",
    "provider": "youtube",
    "video_id": "30m_osNgoUg",
    "channel_id": "yousef_elkott",
    "category_id": "quran_creatures",
    "title": {
      "ar": "الجراد | كيف أصبح بلاءً على قوم فرعون؟"
    },
    "language": "ar",
    "depth": "detailed",
    "duration_seconds": 1801,
    "sort_order": 2
  },
  {
    "id": "quran_creatures:youtube:imhdrxIJuFo",
    "provider": "youtube",
    "video_id": "imhdrxIJuFo",
    "channel_id": "yousef_elkott",
    "category_id": "quran_creatures",
    "title": {
      "ar": "البعوض | ماذا سيحدث لو اختفى من العالم؟"
    },
    "language": "ar",
    "depth": "detailed",
    "duration_seconds": 1471,
    "sort_order": 3
  },
  {
    "id": "quran_creatures:youtube:JjSxK4TUiMY",
    "provider": "youtube",
    "video_id": "JjSxK4TUiMY",
    "channel_id": "yousef_elkott",
    "category_id": "quran_creatures",
    "title": {
      "ar": "العنكبوت | لماذا وصف الله بيته بأنه أوهن البيوت؟"
    },
    "language": "ar",
    "depth": "detailed",
    "duration_seconds": 2286,
    "sort_order": 4
  },
  {
    "id": "quran_creatures:youtube:4k0XQ_5MBGM",
    "provider": "youtube",
    "video_id": "4k0XQ_5MBGM",
    "channel_id": "yousef_elkott",
    "category_id": "quran_creatures",
    "title": {
      "ar": "النحل | هل سيختفي العالم باختفاء النحل ؟"
    },
    "language": "ar",
    "depth": "detailed",
    "duration_seconds": 3818,
    "sort_order": 5
  },
  {
    "id": "quran_creatures:youtube:7KmPtQPZsOY",
    "provider": "youtube",
    "video_id": "7KmPtQPZsOY",
    "channel_id": "yousef_elkott",
    "category_id": "quran_creatures",
    "title": {
      "ar": "النمل | ماذا سيحدث لنا لو اختفى من الأرض؟"
    },
    "language": "ar",
    "depth": "detailed",
    "duration_seconds": 2646,
    "sort_order": 6
  }
]
